{
  "regulatory_and_market_events": [
    {
      "event_id": "REG-1",
      "source_ids": [
        "SRC-N1"
      ]
    }
  ],
  "capital_and_ownership_events": [
    {
      "event_id": "CAP-1",
      "source_ids": [
        "SRC-B1"
      ]
    }
  ],
  "model_records": [],
  "supplier_dependency_relationships": [
    {
      "dependency_id": "SUP-1",
      "source_ids": [
        "SRC-N2"
      ]
    }
  ],
  "governance_and_leadership_events": []
}
